Book Id,Title,Author,Author l-f,Additional Authors,ISBN,ISBN13,My Rating,Average Rating,Publisher,Binding,Number of Pages,Year Published,Original Publication Year,Date Read,Date Added,Bookshelves,Bookshelves with positions,Exclusive Shelf,My Review,Spoiler,Private Notes,Read Count,Recommended For,Recommended By,Owned Copies,Original Purchase Date,Original Purchase Location,Condition,Condition Description,BCID
23462846,Vedic Voices: Intimate Narratives of a Living Andhra Tradition,David M. Knipe,"Knipe, David M.",,"=""0199397686""","=""9780199397686""",4,3.91,"Oxford University Press, USA",Hardcover,368,2015,2015,,2019/02/26,"personalities, society-and-morals","personalities (#6), society-and-morals (#20)",read,,,,1,,,0,,,,,
17377791,"The Land That Time Forgot (Caspak, #1)",Edgar Rice Burroughs,"Burroughs, Edgar Rice",,"=""""","=""""",4,3.79,Public Domain Books,Kindle Edition,148,2012,1918,,2018/02/27,science-fiction-and-fantasy,science-fiction-and-fantasy (#91),read,,,,1,,,0,,,,,
66473,Toxin,Robin Cook,"Cook, Robin",,"=""0425166619""","=""9780425166611""",4,3.80,G.P. Putnam's Sons,Paperback,432,1999,1998,,2018/02/27,"science-fiction-and-fantasy, detective","science-fiction-and-fantasy (#83), detective (#8)",read,,,,1,,,0,,,,,
3869,A Brief History of Time,Stephen Hawking,"Hawking, Stephen",,"=""0553380168""","=""9780553380163""",5,4.18,Bantam Books,Paperback,212,1998,1988,,2018/08/16,science,science (#8),read,,,,1,,,0,,,,,
2358405,Brain Teasers,Ravi Narula,"Narula, Ravi",,"=""8172240317""","=""9788172240318""",5,3.43,Jaico Publishing House,Paperback,228,1976,1976,,2018/07/12,,,read,,,,1,,,0,,,,,
3359587,Your First Move: Chess for Beginners,Alexey Sokolsky,"Sokolsky, Alexey",,"=""0828521603""","=""9780828521604""",4,4.32,Imported Pubn,Hardcover,296,1982,1982,,2018/07/12,"math, nayah","math (#9), nayah (#2)",read,,,,1,,,0,,,,,
425209,Randomized Algorithms,Rajeev Motwani,"Motwani, Rajeev",Prabhakar Raghavan,"=""0521474655""","=""9780521474658""",0,4.07,Cambridge University Press,Hardcover,496,1995,1995,,2018/06/25,math,math (#7),read,,,,0,,,0,,,,,
27543,Artificial Intelligence: A Modern Approach,Stuart Russell,"Russell, Stuart",Peter Norvig,"=""0137903952""","=""9780137903955""",4,4.18,Prentice Hall,Hardcover,1132,2002,1994,,2018/06/25,science,science (#6),read,,,,1,,,0,,,,,
950251,Calculus and Analytic Geometry ,George B. Thomas Jr.,"Jr., George B. Thomas",Ross L. Finney,"=""0201531747""","=""9780201531749""",5,4.13,Addison Wesley Publishing Company,Hardcover,,1995,1920,,2018/02/27,math,math (#6),read,,,,1,,,0,,,,,
4991297,Plane trigonometry,Sidney Luxton Loney,"Loney, Sidney Luxton",,"=""1418185094""","=""9781418185091""",5,4.62,University of Michigan Library,Paperback,536,2006,1899,,2018/02/27,math,math (#5),read,,,,1,,,0,,,,,
26087097,Plane Trigonometry - Part - 1,Sidney Luxton Loney,"Loney, Sidney Luxton",,"=""9352030540""","=""""",5,4.26,Arihant,Paperback,270,2015,2015,,2018/06/25,math,math (#4),read,,,,1,,,0,,,,,
241344,Sears and Zemansky's University Physics,Hugh D. Young,"Young, Hugh D.",,"=""0201603225""","=""9780201603224""",4,4.08,Addison Wesley Publishing Company,Hardcover,1274,1999,1960,,2018/02/27,science,science (#5),read,,,,1,,,0,,,,,
148030,Convex Optimization,Stephen Boyd,"Boyd, Stephen",Lieven Vandenberghe,"=""0521833787""","=""9780521833783""",3,4.48,Cambridge University Press,Hardcover,727,2004,2004,,2018/06/25,math,math (#2),read,,,,1,,,0,,,,,
1372376,Numerical Linear Algebra,Lloyd N. Trefethen,"Trefethen, Lloyd N.",David Bau III,"=""0898713617""","=""9780898713619""",3,4.24,Society for Industrial and Applied Mathematics (SIAM),Paperback,184,1997,1997,,2018/06/25,math,math (#1),read,,,,1,,,0,,,,,
27843037,Indeh: A Story of the Apache Wars,Ethan Hawke,"Hawke, Ethan",Greg Ruth,"=""1401310990""","=""9781401310998""",3,3.66,Grand Central Publishing,Hardcover,232,2016,2016,,2018/06/21,"history, comic","history (#6), comic (#23)",read,,,,1,,,0,,,,,
55676,India: A Million Mutinies Now,V.S. Naipaul,"Naipaul, V.S.",,"=""0140156801""","=""9780140156805""",0,3.92,Penguin Books,Paperback,480,1992,1990,,2018/02/27,"society-and-morals, to-read","society-and-morals (#16), to-read (#9)",to-read,,,,1,,,0,,,,,
460669,Getting What You Came For: The Smart Student's Guide to Earning a Master's or Ph.D.,Robert L. Peters,"Peters, Robert L.",,"=""0374524777""","=""9780374524777""",3,3.85,"Farrar, Straus and Giroux",Paperback,399,1997,1992,,2018/06/13,"society-and-morals, nayah","society-and-morals (#18), nayah (#1)",read,I read this when I was about to go to grad school. I hoped that it would help me thrive in the PhD program - I failed anyway - but this helped me get some confidence at the time.,,,1,,,0,,,,,
17210470,"Boxers (Boxers & Saints, #1)",Gene Luen Yang,"Yang, Gene Luen",,"=""1596433590""","=""9781596433595""",4,3.88,First Second,Paperback,328,2013,2013,,2018/05/19,"comic, history","comic (#22), history (#5)",read,"Ah! The chinese then wore braids and shaved forehead like we do! So - the primary and secondary devils (zombie cult missionaries and converts) behaved thus in their mental disease! Ah - the Chinese deities thus inspired their devotees! What art, what fists, what resolve! That this spirit survived the failure of the boxing rebellion (with major injuries) gladdens the heart.",,,1,,,0,,,,,
17671223,Mahakshatriya,Devudu Narasimhashastri,"Narasimhashastri, Devudu",,"=""""","=""""",5,4.31,,,,,,2018/05/19,2018/05/19,"mythology-प-र-ण-न, atma-tattvam","mythology-प-र-ण-न (#6), atma-tattvam (#19)",read,उत्तमम् उपब्रह्मणम् पुराणस्य। धीरोदात्तस्य नहुषस्य पठित्वा गाथामिमां न कः स्याद् धर्मम् प्रत्याकृष्टः?!,,,1,,,0,,,,,
165526,"The Red Sea Sharks (Tintin, #19)",Hergé,"Hergé, Hergé",,"=""1405206306""","=""9781405206303""",3,3.99,Egmont,Paperback,64,2012,1958,,2018/04/19,"adventure, comic","adventure (#25), comic (#21)",read,,,,1,,,0,,,,,
146108,"King Ottokar's Sceptre (Tintin, #8)",Hergé,"Hergé, Hergé","Michael      Turner, Leslie Lonsdale-Cooper","=""0416605109""","=""9780416605105""",4,4.02,Mammoth,Hardcover,62,1997,1939,,2018/04/19,"adventure, comic","adventure (#24), comic (#20)",read,,,,1,,,0,,,,,
146109,"Red Rackham's Treasure (Tintin, #12)",Hergé,"Hergé, Hergé","Leslie Lonsdale-Cooper, Michael      Turner","=""1405206233""","=""9781405206235""",4,4.27,Egmont,Paperback,64,2012,1943,,2018/04/19,"adventure, comic","adventure (#23), comic (#19)",read,,,,1,,,0,,,,,
146107,The Shooting Star (Tintin #10),Hergé,"Hergé, Hergé",,"=""1405206217""","=""9781405206211""",3,3.91,Egmont UK Limited,Paperback,62,2002,1942,,2018/04/19,"adventure, comic","adventure (#22), comic (#18)",read,,,,1,,,0,,,,,
179172,"Destination Moon (Tintin, #16)",Hergé,"Hergé, Hergé","Leslie Lonsdale-Cooper, Michael      Turner","=""0316358452""","=""9780316358453""",4,4.19,"Little, Brown and Co.",Paperback,62,1976,1950,,2018/04/19,"adventure, comic","adventure (#21), comic (#17)",read,,,,1,,,0,,,,,
96428,"Prisoners of the Sun (Tintin, #14)",Hergé,"Hergé, Hergé",,"=""140520625X""","=""9781405206259""",4,4.23,Egmont,Paperback,62,2002,1946,,2018/04/19,"adventure, comic","adventure (#20), comic (#16)",read,,,,1,,,0,,,,,
6443100,"The Calculus Affair (Tintin, #18)",Hergé,"Hergé, Hergé","Leslie Lonsdale-Cooper, Michael      Turner","=""0316358479""","=""9780316358477""",4,4.14,"Little, Brown and Co.",Paperback,62,1976,1953,,2018/04/19,"adventure, comic","adventure (#19), comic (#15)",read,,,,1,,,0,,,,,
146122,Cigars of the Pharaoh (Tintin #4),Hergé,"Hergé, Hergé",,"=""""","=""""",5,4.06,,ebook,63,,1934,,2018/04/19,"adventure, comic","adventure (#18), comic (#14)",read,,,,1,,,0,,,,,
2895675,Asterix Conquers America,Albert Uderzo,"Uderzo, Albert",,"=""075286839X""","=""9780752868394""",4,4.04,Orion,,48,2005,1995,,2018/04/19,"comic, adventure","comic (#13), adventure (#17)",read,,,,1,,,0,,,,,
122448,Asterix and the Magic Carpet (Asterix #28),Albert Uderzo,"Uderzo, Albert",,"=""0752847767""","=""9780752847764""",3,3.93,Asterix,Paperback,48,2002,1987,,2018/04/19,"adventure, comic","adventure (#16), comic (#12)",read,,,,1,,,0,,,,,
122413,"Asterix and the Laurel Wreath (Asterix, #18)",René Goscinny,"Goscinny, René",Albert Uderzo,"=""0752866370""","=""9780752866376""",3,4.13,Asterix,Paperback,48,2004,1971,,2018/04/19,"adventure, comic","adventure (#15), comic (#11)",read,,,,1,,,0,,,,,
122403,"Asterix and the Chieftain's Shield (Asterix, #11)",René Goscinny,"Goscinny, René",Albert Uderzo,"=""0752866249""","=""9780752866246""",4,4.16,Asterix,Hardcover,48,2004,1967,,2018/04/19,"comic, adventure","comic (#10), adventure (#14)",read,,,,1,,,0,,,,,
122439,"Asterix and the Golden Sickle (Asterix, #2)",René Goscinny,"Goscinny, René","Albert Uderzo, Anthea Bell, Derek Hockridge","=""0752866133""","=""9780752866130""",4,4.14,Asterix,Paperback,46,2004,1960,,2018/04/19,"adventure, comic","adventure (#13), comic (#9)",read,,,,1,,,0,,,,,
122405,Asterix and Caesar's Gift (Astérix #21),René Goscinny,"Goscinny, René",Albert Uderzo,"=""075286646X""","=""9780752866468""",3,4.12,Asterix,Paperback,48,2004,1974,,2018/04/19,"comic, adventure","comic (#8), adventure (#12)",read,,,,1,,,0,,,,,
122404,"Asterix and the Big Fight (Asterix, #7)",René Goscinny,"Goscinny, René",Albert Uderzo,"=""0752866168""","=""9780752866161""",3,4.16,Asterix,Hardcover,48,2004,1966,,2018/04/19,"comic, adventure","comic (#7), adventure (#11)",read,,,,1,,,0,,,,,
122447,Asterix and Son (Asterix #27),Albert Uderzo,"Uderzo, Albert",,"=""0752847759""","=""9780752847757""",3,3.80,Asterix,Paperback,48,2001,1983,,2018/04/19,"adventure, comic","adventure (#10), comic (#6)",read,,,,1,,,0,,,,,
122421,"Asterix and the Banquet (Astérix, #5)",René Goscinny,"Goscinny, René",Albert Uderzo,"=""0752866095""","=""9780752866093""",4,4.16,Asterix,Paperback,48,2004,1963,,2018/04/19,"comic, adventure","comic (#5), adventure (#9)",read,,,,1,,,0,,,,,
71300,"Asterix and the Soothsayer (Asterix, #19)",René Goscinny,"Goscinny, René",Albert Uderzo,"=""0752866427""","=""9780752866420""",4,4.12,Asterix,Paperback,48,2004,1972,,2018/04/19,"adventure, comic","adventure (#8), comic (#4)",read,,,,1,,,0,,,,,
122410,"Asterix and Cleopatra (Asterix, #6)",René Goscinny,"Goscinny, René",Albert Uderzo,"=""0752866079""","=""9780752866079""",4,4.31,Asterix,Paperback,48,2004,1965,,2018/04/19,"comic, adventure","comic (#3), adventure (#7)",read,,,,1,,,0,,,,,
71299,"Asterix in Britain (Asterix, #8)",René Goscinny,"Goscinny, René",Albert Uderzo,"=""0752866192""","=""9780752866192""",4,4.28,Asterix,Paperback,48,2004,1965,,2018/04/19,"comic, adventure","comic (#2), adventure (#6)",read,,,,1,,,0,,,,,
122438,"Asterix in Switzerland (Asterix, #16)",René Goscinny,"Goscinny, René",Albert Uderzo,"=""0752866354""","=""9780752866352""",5,4.23,Asterix,Paperback,48,2004,1970,,2018/04/19,"comic, adventure","comic (#1), adventure (#5)",read,,,,1,,,0,,,,,
39789013,The Vetala,Phillip Ernest,"Ernest, Phillip",,"=""""","=""9781988130675""",4,4.20,Linda Leith Publishing,ebook,255,2018,,,2018/04/09,"mythology-प-र-ण-न, science-fiction-and-fantasy","mythology-प-र-ण-न (#5), science-fiction-and-fantasy (#145)",read,"A good plot at the high level. There are some loose ends and it gets rather incredible for some time in the middle - but overall the story is quite gripping. Phillip uses his facility with basic Sanskrit versification to good effect in developing the story - the sanskrit is impeccable. The story captures the feeling of expatriate Indological experiences (centered around Pune) and attitudes quite well. Rare excerpts might irritate or amuse native Indian readers, but that's excusable given the identity of the author and the main characters. Overall any hindu sanskrit speaker will enjoy it.",,,1,,,0,,,,,
7184,Twenty Years After (The D'Artagnan Romances #2),Alexandre Dumas,"Dumas, Alexandre","David Coward, Auguste Maquet","=""0192838431""","=""9780192838438""",4,4.05,Oxford University Press,Paperback,788,1993,1845,,2018/03/10,,,read,,,,1,,,0,,,,,
2898332,Robin Hood (Grandes Aventuras),Walter Scott,"Scott, Walter",,"=""9706079246""","=""9789706079244""",3,3.89,Larousse Kingfisher Chambers,Paperback,248,,1987,,2018/03/10,,,read,,,,1,,,0,,,,,
296264,The Black Arrow,Robert Louis Stevenson,"Stevenson, Robert Louis",,"=""0543896609""","=""9780543896605""",3,3.81,Adamant Media Corporation,Paperback,242,2001,1883,,2018/03/10,"history, adventure","history (#4), adventure (#4)",read,,,,1,,,0,,,,,
295,Treasure Island,Robert Louis Stevenson,"Stevenson, Robert Louis","David W. Whitehead, Richard S. Hartmetz","=""0753453800""","=""9780753453803""",4,3.83,Kingfisher,Hardcover,311,2001,1879,,2018/03/10,adventure,adventure (#3),read,,,,1,,,0,,,,,
51496,The Strange Case of Dr. Jekyll and Mr. Hyde,Robert Louis Stevenson,"Stevenson, Robert Louis","Vladimir Nabokov, Mervyn Peake, Théo Varlet, Patrick Horgan, Dan Chaon","=""0451528956""","=""9780451528957""",0,3.82,Signet Classics,Paperback,144,2003,1886,,2018/03/10,adventure,adventure (#2),read,,,,0,,,0,,,,,
24886234,The Internet to the Inner-Net: Five Ways to Reset Your Connection and Live a Conscious Life,Gopi Kallayil,"Kallayil, Gopi",,"=""1401944507""","=""9781401944506""",5,3.96,"Hay House, Inc.",Hardcover,264,2015,2015,,2018/03/06,"atma-tattvam, personalities","atma-tattvam (#18), personalities (#5)",read,"Gopi Kallayil the person, and his adventures and anecdotes are fascinating (more so as an Indian with a similar background).  It's a page-turner - your dopamine system will keep you going, and you can collect a few worthy quotes and anecdotes. <br/><br/>His advice might be useful for some people, but fortunately it was mostly what I've long internalized. At a personal level, they're good. At a social level, his comments are meh (Thankfully that part is small).",,,1,,,0,,,,,
35167685,"""Surely You're Joking, Mr. Feynman!"": Adventures of a Curious Character",Richard P. Feynman,"Feynman, Richard P.",,"=""0393355624""","=""9780393355628""",5,4.27,W. W. Norton  Company,Paperback,400,2018,1985,,2018/02/27,personalities,personalities (#1),read,,,,1,,,0,,,,,
947964,Invasion,Robin Cook,"Cook, Robin",,"=""0425155404""","=""9780425155400""",4,3.61,Berkley Books,Paperback,338,1997,1997,,2018/02/27,science-fiction-and-fantasy,science-fiction-and-fantasy (#144),read,,,,1,,,0,,,,,
1567402,"Sos the Rope (Battle Circle, #1)",Piers Anthony,"Anthony, Piers",,"=""0511018900""","=""""",0,3.82,Pyramid Books X-1890,Paperback,157,1968,1968,,2018/02/27,science-fiction-and-fantasy,science-fiction-and-fantasy (#143),read,,,,0,,,0,,,,,
1013785,Cradle,Arthur C. Clarke,"Clarke, Arthur C.",Gentry Lee,"=""0446356018""","=""9780446356015""",0,3.44,Warner Books,Paperback,408,1989,1987,,2018/02/27,science-fiction-and-fantasy,science-fiction-and-fantasy (#142),read,,,,0,,,0,,,,,
414999,Childhood's End,Arthur C. Clarke,"Clarke, Arthur C.",,"=""""","=""""",0,4.10,Del Rey Books,Mass Market Paperback,224,1987,1953,,2018/02/27,science-fiction-and-fantasy,science-fiction-and-fantasy (#141),read,,,,0,,,0,,,,,
149049,The Fountains of Paradise,Arthur C. Clarke,"Clarke, Arthur C.",,"=""0446677949""","=""9780446677943""",0,3.96,Aspect,Paperback,352,2001,1979,,2018/02/27,science-fiction-and-fantasy,science-fiction-and-fantasy (#140),read,,,,0,,,0,,,,,
50832,Orphans of the Sky,Robert A. Heinlein,"Heinlein, Robert A.",,"=""0671318454""","=""9780671318451""",3,3.79,Baen,Paperback,224,2001,1963,,2018/02/27,science-fiction-and-fantasy,science-fiction-and-fantasy (#139),read,,,,1,,,0,,,,,
16689,Citizen of the Galaxy,Robert A. Heinlein,"Heinlein, Robert A.",,"=""1416505520""","=""9781416505525""",3,3.99,Pocket Books: Gallery Books,Paperback,288,2005,1957,,2018/02/27,science-fiction-and-fantasy,science-fiction-and-fantasy (#138),read,,,,1,,,0,,,,,
17214,Starship Troopers,Robert A. Heinlein,"Heinlein, Robert A.",,"=""0441783589""","=""9780441783588""",3,4.00,Ace Book,Mass Market Paperback,335,1987,1959,,2018/02/27,science-fiction-and-fantasy,science-fiction-and-fantasy (#137),read,,,,1,,,0,,,,,
16685,The Cat Who Walks Through Walls (The World As Myth),Robert A. Heinlein,"Heinlein, Robert A.",,"=""0441094996""","=""9780441094998""",1,3.71,Ace Books,Paperback,388,1988,1985,,2018/02/27,science-fiction-and-fantasy,science-fiction-and-fantasy (#136),read,,,,1,,,0,,,,,
43917,"Rise of a Merchant Prince (The Serpentwar Saga, #2)",Raymond E. Feist,"Feist, Raymond E.",,"=""0006497012""","=""9780006497011""",0,4.06,Voyager,Paperback,479,1996,1995,,2018/02/27,science-fiction-and-fantasy,science-fiction-and-fantasy (#135),read,,,,0,,,0,,,,,
169959,"The King's Buccaneer (Krondor's Sons, #2)",Raymond E. Feist,"Feist, Raymond E.",,"=""0553563734""","=""9780553563733""",0,4.03,Bantam Spectra,Mass Market Paperback,523,1994,1992,,2018/02/27,science-fiction-and-fantasy,science-fiction-and-fantasy (#134),read,,,,0,,,0,,,,,
589979,"Daughter of the Empire (The Empire Trilogy, #1)",Raymond E. Feist,"Feist, Raymond E.",Janny Wurts,"=""055327211X""","=""9780553272116""",0,4.27,Spectra,Mass Market Paperback,421,1988,1987,,2018/02/27,science-fiction-and-fantasy,science-fiction-and-fantasy (#133),read,,,,0,,,0,,,,,
13812,"Magician: Apprentice (The Riftwar Saga, #1)",Raymond E. Feist,"Feist, Raymond E.",,"=""0553564943""","=""9780553564945""",0,4.14,Bantam Spectra,Mass Market Paperback,485,1994,1982,,2018/02/27,science-fiction-and-fantasy,science-fiction-and-fantasy (#132),read,,,,0,,,0,,,,,
13878,"Prince of the Blood (Krondor's Sons, #1)",Raymond E. Feist,"Feist, Raymond E.",,"=""0553588117""","=""9780553588118""",0,3.99,BantamSpectra,Paperback,429,2007,1989,,2018/02/27,science-fiction-and-fantasy,science-fiction-and-fantasy (#131),read,,,,0,,,0,,,,,
12260349,The Wood Boy,Raymond E. Feist,"Feist, Raymond E.",,"=""""","=""""",0,3.39,,,27,,1999,,2018/02/27,science-fiction-and-fantasy,science-fiction-and-fantasy (#130),read,,,,0,,,0,,,,,
92918,"Krondor: The Betrayal (The Riftwar Legacy, #1)",Raymond E. Feist,"Feist, Raymond E.",,"=""0380795272""","=""9780380795277""",0,3.86,HarperCollins Publishers,Mass Market Paperback,411,2001,1998,,2018/02/27,science-fiction-and-fantasy,science-fiction-and-fantasy (#129),read,,,,0,,,0,,,,,
13818,"Krondor: The Assassins (The Riftwar Legacy, #2)",Raymond E. Feist,"Feist, Raymond E.",,"=""0380803232""","=""9780380803231""",0,3.88,Harper Torch,Mass Market Paperback,350,2000,1999,,2018/02/27,science-fiction-and-fantasy,science-fiction-and-fantasy (#128),read,,,,0,,,0,,,,,
951749,The Dying Earth (The Dying Earth #1),Jack Vance,"Vance, Jack",,"=""0671831526""","=""9780671831523""",0,3.92,Pocket Books,Paperback,156,1977,1950,,2018/02/27,science-fiction-and-fantasy,science-fiction-and-fantasy (#127),read,,,,0,,,0,,,,,
13642,"A Wizard of Earthsea (Earthsea Cycle, #1)",Ursula K. Le Guin,"Guin, Ursula K. Le",,"=""0553383043""","=""9780553383041""",1,3.99,Bantam Spectra,Paperback,183,2004,1967,,2018/02/27,science-fiction-and-fantasy,science-fiction-and-fantasy (#126),read,,,,1,,,0,,,,,
64394,"The Stainless Steel Rat (Stainless Steel Rat, #4)",Harry Harrison,"Harrison, Harry",,"=""1857984986""","=""9781857984989""",0,3.93,Orion,Mass Market Paperback,208,1998,1961,,2018/02/27,science-fiction-and-fantasy,science-fiction-and-fantasy (#125),read,,,,0,,,0,,,,,
101527,"In the Balance (Worldwar, #1)",Harry Turtledove,"Turtledove, Harry",,"=""034542056X""","=""9780345420565""",1,3.82,Ballantine Books,Paperback,465,1996,1994,,2018/02/27,science-fiction-and-fantasy,science-fiction-and-fantasy (#17),read,,,,1,,,0,,,,,
7902912,Manna,Marshall Brain,"Brain, Marshall",,"=""""","=""""",4,3.94,,ebook,79,2003,2003,,2018/02/27,"science-fiction-and-fantasy, society-and-morals","science-fiction-and-fantasy (#123), society-and-morals (#17)",read,,,,1,,,0,,,,,
17184,The Invisible Man,H.G. Wells,"Wells, H.G.",,"=""0451528522""","=""9780451528520""",4,3.64,Signet Classics,Paperback,192,2002,1897,,2018/02/27,science-fiction-and-fantasy,science-fiction-and-fantasy (#122),read,,,,1,,,0,,,,,
2493,The Time Machine,H.G. Wells,"Wells, H.G.","Greg Bear, Carlo Pagetti","=""""","=""""",3,3.89,Signet Classics,Paperback,118,2002,1895,,2018/02/27,science-fiction-and-fantasy,science-fiction-and-fantasy (#121),read,,,,1,,,0,,,,,
32827,"From the Earth to the Moon (Extraordinary Voyages, #4)",Jules Verne,"Verne, Jules",,"=""1598184547""","=""9781598184549""",4,3.79,Aegypan,Paperback,136,2006,1865,,2018/02/27,science-fiction-and-fantasy,science-fiction-and-fantasy (#120),read,,,,1,,,0,,,,,
49596,The Secret Adversary (Tommy and Tuppence #1),Agatha Christie,"Christie, Agatha",,"=""1600963943""","=""9781600963940""",3,3.85,Waking Lion Press,Paperback,268,2008,1922,,2018/02/27,detective,detective (#7),read,,,,1,,,0,,,,,
3586,The Complete Sherlock Holmes: Volume II,Arthur Conan Doyle,"Doyle, Arthur Conan",Kyle Freeman,"=""1593082045""","=""9781593082048""",4,4.47,Barnes  Noble Classics,Hardcover,709,2004,1914,,2018/02/27,detective,detective (#6),read,,,,1,,,0,,,,,
188572,The Complete Sherlock Holmes,Arthur Conan Doyle,"Doyle, Arthur Conan",,"=""0553328255""","=""9780553328257""",5,4.47,Bantam Classics,Paperback,1796,1986,1927,,2018/02/27,"detective, personalities","detective (#5), personalities (#3)",read,,,,1,,,0,,,,,
3590,"The Adventures of Sherlock Holmes (Sherlock Holmes, #3)",Arthur Conan Doyle,"Doyle, Arthur Conan",,"=""""","=""""",5,4.30,Oxford University Press,Paperback,389,1998,1892,,2018/02/27,"detective, personalities","detective (#4), personalities (#2)",read,,,,1,,,0,,,,,
66470,"Chromosome 6 (Jack Stapleton & Laurie Montgomery, #3)",Robin Cook,"Cook, Robin",,"=""0425161242""","=""9780425161241""",5,3.90,G.P. Putnam's Sons,Paperback,456,1998,1997,,2018/02/27,science-fiction-and-fantasy,science-fiction-and-fantasy (#79),read, geneticist creates an evil genius of a boy - and ends up killing him in the end.,true,,1,,,0,,,,,
54161,Among the Believers : An Islamic Journey,V.S. Naipaul,"Naipaul, V.S.",,"=""0330413333""","=""9780330413336""",4,3.85,Picador,Paperback,495,2003,1981,,2018/02/27,society-and-morals,society-and-morals (#15),read,,,,1,,,0,,,,,
277950,Hagakure: The Book of the Samurai,Yamamoto Tsunetomo,"Tsunetomo, Yamamoto",William Scott Wilson,"=""4770029160""","=""9784770029164""",5,4.06,Kodansha,Hardcover,179,2002,1716,,2018/02/27,"atma-tattvam, society-and-morals","atma-tattvam (#17), society-and-morals (#14)",read,,,,1,,,0,,,,,
67896,Tao Te Ching,Lao Tzu,"Tzu, Lao","Gia-Fu Feng, Jane English, Toinette Lippe, Jacob Needleman","=""0679724346""","=""9780679724346""",4,4.27,Vintage,Paperback,160,1989,-600,,2018/02/27,atma-tattvam,atma-tattvam (#16),read,,,,1,,,0,,,,,
402843,"Zen Mind, Beginner's Mind: Informal Talks on Zen Meditation and Practice",Shunryu Suzuki,"Suzuki, Shunryu","Trudy Dixon, Huston Smith, Richard Baker","=""0834800799""","=""9780834800793""",4,4.21,Weatherhill,Paperback,138,1973,1970,,2018/02/27,atma-tattvam,atma-tattvam (#15),read,,,,1,,,0,,,,,
36064445,Skin in the Game: The Hidden Asymmetries in Daily Life,Nassim Nicholas Taleb,"Taleb, Nassim Nicholas",,"=""0241300657""","=""9780241300657""",0,3.89,Allen Lane,Paperback,272,2018,2018,,2018/02/27,"to-read, atma-tattvam","to-read (#8), atma-tattvam (#14)",to-read,,,,0,,,0,,,,,
13438871,The Natural State (The unrational ideas of a man called U.G.),U.G. Krishnamurti,"Krishnamurti, U.G.",,"=""""","=""""",3,4.70,Practical Magic,ebook,,,2007,,2018/02/27,atma-tattvam,atma-tattvam (#13),read,,,,1,,,0,,,,,
9704019,Thought Is Dead: Moving Beyond Spiritual Materialism,U.G. Krishnamurti,"Krishnamurti, U.G.",,"=""1453709371""","=""9781453709375""",3,4.14,,,,,2010,,2018/02/27,atma-tattvam,atma-tattvam (#11),read,,,,1,,,0,,,,,
6037474,Stopped in Our Tracks: Stories of U.G. in India,U.G. Krishnamurti,"Krishnamurti, U.G.",K. Chandrasekhar,"=""""","=""""",4,4.60,,Kindle Edition,,,2008,,2018/02/27,atma-tattvam,atma-tattvam (#12),read,,,,1,,,0,,,,,
53533,The Mystique of Enlightenment: Conversations with U. G. Krishnamurti,Rodney Arms,"Arms, Rodney",Sunita Pant Bansal,"=""8187967099""","=""9788187967095""",4,4.50,Smriti Books,Paperback,206,2005,2005,,2018/02/27,atma-tattvam,atma-tattvam (#5),read,,,,1,,,0,,,,,
14374383,The Anti Guru: A Selection of His Greatest Talks,U.G. Krishnamurti,"Krishnamurti, U.G.",,"=""1461013089""","=""9781461013082""",4,4.38,Createspace Independent Publishing Platform,Paperback,138,2011,2011,,2018/02/27,atma-tattvam,atma-tattvam (#7),read,,,,1,,,0,,,,,
6037462,No Way Out: Dialogues with Krishnamurti,U.G. Krishnamurti,"Krishnamurti, U.G.",,"=""""","=""""",4,4.25,,Kindle Edition,,,2005,,2018/02/27,atma-tattvam,atma-tattvam (#6),read,,,,1,,,0,,,,,
53532,The Other Side of Belief: Interpreting U.G. Krishnamurti,Mukunda Rao,"Rao, Mukunda",U.G. Krishnamurti,"=""0144000350""","=""9780144000357""",4,4.22,"Penguin Books, Limited (UK)",Paperback,350,2005,2005,,2018/02/27,atma-tattvam,atma-tattvam (#8),read,,,,1,,,0,,,,,
53528,Courage to Stand Alone: Conversations with U.G. Krishnamurti,Ellen J. Chrystal,"Chrystal, Ellen J.",Mahesh Bhatt,"=""8187967064""","=""9788187967064""",4,3.58,Spb Enterprises Pvt Ltd,Paperback,126,2001,2001,,2018/02/27,atma-tattvam,atma-tattvam (#9),read,,,,1,,,0,,,,,
53531,"U.G. Krishnamurti, A Life",Mahesh Bhatt,"Bhatt, Mahesh",,"=""0141008091""","=""9780141008097""",4,3.82,Penguin India,Paperback,274,2001,1992,,2018/02/27,atma-tattvam,atma-tattvam (#3),read,,,,1,,,0,,,,,
6037472,Thought Is Your Enemy: Conversations With U.G. Krishnamurti,U.G. Krishnamurti,"Krishnamurti, U.G.",,"=""""","=""""",4,4.35,,Kindle Edition,,,2007,,2018/02/27,atma-tattvam,atma-tattvam (#4),read,,,,1,,,0,,,,,
31093,"Lila: An Inquiry Into Morals (Phaedrus, #2)",Robert M. Pirsig,"Pirsig, Robert M.",,"=""0553299611""","=""9780553299618""",4,3.79,Bantam,Paperback,480,1992,1991,,2018/02/27,"atma-tattvam, society-and-morals","atma-tattvam (#2), society-and-morals (#13)",read,,,,1,,,0,,,,,
