Book Id,Title,Author,Author l-f,Additional Authors,ISBN,ISBN13,My Rating,Average Rating,Publisher,Binding,Number of Pages,Year Published,Original Publication Year,Date Read,Date Added,Bookshelves,Bookshelves with positions,Exclusive Shelf,My Review,Spoiler,Private Notes,Read Count,Recommended For,Recommended By,Owned Copies,Original Purchase Date,Original Purchase Location,Condition,Condition Description,BCID
70539,"2010: Odyssey Two (Space Odyssey, #2)",Arthur C. Clarke,"Clarke, Arthur C.",,"=""0345413970""","=""9780345413970""",4,3.92,Del Rey,Paperback,320,1997,1982,,2018/02/27,science-fiction-and-fantasy,science-fiction-and-fantasy (#51),read,,,,1,,,0,,,,,
1746518,"First Family (Amtrak Wars, #2)",Patrick Tilley,"Tilley, Patrick",,"=""0671655671""","=""9780671655679""",4,3.89,Baen Books,Paperback,399,1986,1985,,2018/02/27,science-fiction-and-fantasy,science-fiction-and-fantasy (#46),read,,,,1,,,0,,,,,
2164792,"Earth-Thunder (Amtrak Wars, #6)",Patrick Tilley,"Tilley, Patrick",,"=""0316903213""","=""9780316903219""",4,3.83,,,,,1998,,2018/02/27,science-fiction-and-fantasy,science-fiction-and-fantasy (#48),read,,,,1,,,0,,,,,
60929,"Dawn (Xenogenesis, #1)",Octavia E. Butler,"Butler, Octavia E.",,"=""0446603775""","=""9780446603775""",4,4.13,Warner Books,Paperback,248,1997,1987,,2018/02/27,science-fiction-and-fantasy,science-fiction-and-fantasy (#49),read,,,,1,,,0,,,,,
1746527,"Death-Bringer (Amtrak Wars, #5)",Patrick Tilley,"Tilley, Patrick",,"=""0316903205""","=""9780316903202""",4,3.91,Sphere Books Ltd,Mass Market Paperback,373,1989,1989,,2018/02/27,science-fiction-and-fantasy,science-fiction-and-fantasy (#47),read,,,,1,,,0,,,,,
313998,Johnny Mnemonic,William Gibson,"Gibson, William",Terry Bisson,"=""000224618X""","=""9780002246187""",4,3.77,HarperCollins,Hardcover,160,1996,1981,,2018/02/27,science-fiction-and-fantasy,science-fiction-and-fantasy (#43),read,,,,1,,,0,,,,,
154091,"Mona Lisa Overdrive (Sprawl, #3)",William Gibson,"Gibson, William",,"=""0553281747""","=""9780553281743""",4,3.99,Bantam Spectra,Mass Market Paperback,308,1989,1988,,2018/02/27,science-fiction-and-fantasy,science-fiction-and-fantasy (#42),read,,,,1,,,0,,,,,
2596311,"City of the Chasch (Planet of Adventure, #1)",Jack Vance,"Vance, Jack",,"=""0312940432""","=""9780312940430""",1,3.83,Bluejay,Paperback,200,1986,1968,,2018/02/27,science-fiction-and-fantasy,science-fiction-and-fantasy (#44),read,,,,1,,,0,,,,,
40865,"Planet of Adventure (Planet of Adventure, #1-4)",Jack Vance,"Vance, Jack",,"=""0312854889""","=""9780312854881""",1,4.25,Orb Books,Paperback,544,1993,1968,,2018/02/27,science-fiction-and-fantasy,science-fiction-and-fantasy (#45),read,,,,1,,,0,,,,,
22200,"Count Zero (Sprawl, #2)",William Gibson,"Gibson, William",,"=""0441013678""","=""9780441013678""",4,4.01,Ace Books,Paperback,308,2006,1986,,2018/02/27,science-fiction-and-fantasy,science-fiction-and-fantasy (#41),read,,,,1,,,0,,,,,
77462,"Heechee Rendezvous (Heechee Saga, #3)",Frederik Pohl,"Pohl, Frederik",,"=""0345300556""","=""9780345300553""",4,3.85,Del Rey Books,Paperback,352,1985,1984,,2018/02/27,science-fiction-and-fantasy,science-fiction-and-fantasy (#38),read,,,,1,,,0,,,,,
77463,"The Annals of the Heechee (Heechee Saga, #4)",Frederik Pohl,"Pohl, Frederik",,"=""0345325664""","=""9780345325662""",3,3.75,Del Rey,Mass Market Paperback,341,1988,1987,,2018/02/27,science-fiction-and-fantasy,science-fiction-and-fantasy (#39),read,,,,1,,,0,,,,,
888628,"Neuromancer (Sprawl, #1)",William Gibson,"Gibson, William",Jack Womack,"=""""","=""""",5,3.90,Ace Books,Paperback,320,2000,1984,,2018/02/27,science-fiction-and-fantasy,science-fiction-and-fantasy (#40),read,,,,1,,,0,,,,,
218427,"Gateway (Heechee Saga, #1)",Frederik Pohl,"Pohl, Frederik",,"=""0345475836""","=""9780345475831""",4,4.07,Del Rey,Paperback,278,2004,1977,,2018/02/27,science-fiction-and-fantasy,science-fiction-and-fantasy (#36),read,,,,1,,,0,,,,,
8648,"Xenocide (Ender's Saga, #3)",Orson Scott Card,"Card, Orson Scott",Piotr W. Cholewa,"=""0312861877""","=""9780312861872""",4,3.80,Tor Books,Mass Market Paperback,592,1996,1991,,2018/02/27,science-fiction-and-fantasy,science-fiction-and-fantasy (#34),read,,,,1,,,0,,,,,
31360,"Children of the Mind (Ender's Saga, #4)",Orson Scott Card,"Card, Orson Scott",,"=""0765304740""","=""9780765304742""",3,3.77,Tor Books,Paperback,370,2002,1996,,2018/02/27,science-fiction-and-fantasy,science-fiction-and-fantasy (#35),read,,,,1,,,0,,,,,
7967,"Speaker for the Dead (Ender's Saga, #2)",Orson Scott Card,"Card, Orson Scott",,"=""0812550757""","=""9780812550757""",4,4.07,Tor Books,Paperback,382,1994,1986,,2018/02/27,science-fiction-and-fantasy,science-fiction-and-fantasy (#33),read,,,,1,,,0,,,,,
373399,"Beyond the Blue Event Horizon (Heechee Saga, #2)",Frederik Pohl,"Pohl, Frederik",,"=""0345446674""","=""9780345446671""",4,3.96,Ballantine Books,Paperback,336,2000,1980,,2018/02/27,science-fiction-and-fantasy,science-fiction-and-fantasy (#37),read,,,,1,,,0,,,,,
41810,"The Robots of Dawn (Robot, #3)",Isaac Asimov,"Asimov, Isaac",,"=""0553299492""","=""9780553299496""",4,4.17,Spectra,Paperback,435,1994,1983,,2018/02/27,science-fiction-and-fantasy,science-fiction-and-fantasy (#29),read,,,,1,,,0,,,,,
70787,The Bicentennial Man and Other Stories,Isaac Asimov,"Asimov, Isaac",,"=""1857989325""","=""9781857989328""",4,4.12,Millennium,Paperback,211,2000,1976,,2018/02/27,science-fiction-and-fantasy,science-fiction-and-fantasy (#31),read,,,,1,,,0,,,,,
375802,"Ender's Game (Ender's Saga, #1)",Orson Scott Card,"Card, Orson Scott","Stefan Rudnicki, Harlan Ellison","=""0812550706""","=""9780812550702""",4,4.30,Macmillan Audio,Audiobook,352,2004,1985,,2018/02/27,science-fiction-and-fantasy,science-fiction-and-fantasy (#32),read,,,,1,,,0,,,,,
76688,"Robots and Empire (Robot, #4)",Isaac Asimov,"Asimov, Isaac",,"=""0586062009""","=""9780586062005""",4,4.20,Voyager,Paperback,512,1996,1985,,2018/02/27,science-fiction-and-fantasy,science-fiction-and-fantasy (#30),read,,,,1,,,0,,,,,
41811,The Caves of Steel (Robot #1),Isaac Asimov,"Asimov, Isaac",,"=""""","=""""",4,4.17,Voyager,Mass Market Paperback,206,1997,1954,,2018/02/27,science-fiction-and-fantasy,science-fiction-and-fantasy (#26),read,,,,1,,,0,,,,,
76683,Foundation's Edge (Foundation #4),Isaac Asimov,"Asimov, Isaac",,"=""0553293389""","=""9780553293388""",3,4.14,Bantam/Spectra,Paperback,450,2010,1982,,2018/02/27,science-fiction-and-fantasy,science-fiction-and-fantasy (#27),read,,,,1,,,0,,,,,
30016,"The Naked Sun (Robot, #2)",Isaac Asimov,"Asimov, Isaac",Chris     Moore,"=""""","=""""",4,4.16,HarperCollins Publishers,Mass Market Paperback,208,1996,1956,,2018/02/27,science-fiction-and-fantasy,science-fiction-and-fantasy (#28),read,,,,1,,,0,,,,,
29579,"Foundation (Foundation, #1)",Isaac Asimov,"Asimov, Isaac",,"=""0553803719""","=""9780553803716""",5,4.17,Bantam,Hardcover,244,2004,1951,,2018/02/27,science-fiction-and-fantasy,science-fiction-and-fantasy (#23),read,,,,1,,,0,,,,,
41804,"I, Robot (Robot, #0.1)",Isaac Asimov,"Asimov, Isaac",,"=""0553803700""","=""9780553803709""",5,4.20,Bantam Books,Hardcover,224,2004,1950,,2018/02/27,science-fiction-and-fantasy,science-fiction-and-fantasy (#24),read,,,,1,,,0,,,,,
29581,Foundation and Empire (Foundation #2),Isaac Asimov,"Asimov, Isaac",,"=""0553803727""","=""9780553803723""",4,4.21,Spectra Books,Hardcover,256,2004,1952,,2018/02/27,science-fiction-and-fantasy,science-fiction-and-fantasy (#25),read,,,,1,,,0,,,,,
117,Heretics of Dune (Dune Chronicles #5),Frank Herbert,"Herbert, Frank",,"=""0441328008""","=""9780441328000""",4,3.87,Ace Books,Mass Market Paperback,471,1987,1984,,2018/02/27,science-fiction-and-fantasy,science-fiction-and-fantasy (#22),read,,,,1,,,0,,,,,
106,Dune Messiah (Dune #2),Frank Herbert,"Herbert, Frank",,"=""0441172695""","=""9780441172696""",4,3.88,Ace Books,Mass Market Paperback,331,1987,1969,,2018/02/27,science-fiction-and-fantasy,science-fiction-and-fantasy (#19),read,,,,1,,,0,,,,,
112,Children of Dune (Dune Chronicles #3),Frank Herbert,"Herbert, Frank",,"=""""","=""""",4,3.94,Ace Books,Mass Market Paperback,408,1987,1976,,2018/02/27,science-fiction-and-fantasy,science-fiction-and-fantasy (#20),read,,,,1,,,0,,,,,
234225,"Dune (Dune Chronicles, #1)",Frank Herbert,"Herbert, Frank",Domingo Santos,"=""0340839937""","=""9780340839935""",5,4.23,Hodder & Stoughton,Paperback,604,2006,1965,,2018/02/27,science-fiction-and-fantasy,science-fiction-and-fantasy (#18),read,,,,1,,,0,,,,,
42432,God Emperor of Dune (Dune Chronicles #4),Frank Herbert,"Herbert, Frank",,"=""0575075066""","=""9780575075061""",4,3.86,Victor Gollancz,Paperback,454,2003,1981,,2018/02/27,science-fiction-and-fantasy,science-fiction-and-fantasy (#21),read,,,,1,,,0,,,,,
834333,20000 Leagues Under the Sea,Jules Verne,"Verne, Jules",,"=""0679602534""","=""9780679602538""",5,3.89,Modern Library,Hardcover,406,2001,1870,,2018/02/27,science-fiction-and-fantasy,science-fiction-and-fantasy (#14),read,,,,1,,,0,,,,,
32829,"Journey to the Center of the Earth (Extraordinary Voyages, #3)",Jules Verne,"Verne, Jules",,"=""0553213970""","=""9780553213973""",4,3.86,Bantam,Paperback,240,2006,1864,,2018/02/27,science-fiction-and-fantasy,science-fiction-and-fantasy (#15),read,,,,1,,,0,,,,,
50840,Farnham's Freehold,Robert A. Heinlein,"Heinlein, Robert A.",,"=""1416520937""","=""9781416520931""",4,3.56,Baen Books,Paperback,294,2006,1964,,2018/02/27,science-fiction-and-fantasy,science-fiction-and-fantasy (#13),read,,,,1,,,0,,,,,
54479,Around the World in Eighty Days,Jules Verne,"Verne, Jules","Michael Glencross, Brian W. Aldiss","=""014044906X""","=""9780140449068""",4,3.94,Penguin Books ,Paperback,252,2004,1872,,2018/02/27,science-fiction-and-fantasy,science-fiction-and-fantasy (#16),read,,,,1,,,0,,,,,
16690,The Moon Is a Harsh Mistress,Robert A. Heinlein,"Heinlein, Robert A.",,"=""0340837942""","=""9780340837948""",4,4.15,Hodder & Stoughton,Paperback,288,2005,1966,,2018/02/27,science-fiction-and-fantasy,science-fiction-and-fantasy (#12),read,,,,1,,,0,,,,,
61666,Contact,Carl Sagan,"Sagan, Carl",William Olivier Desmond,"=""2266079999""","=""9782266079990""",4,4.13,Pocket,Mass Market Paperback,580,1997,1985,,2018/02/27,science-fiction-and-fantasy,science-fiction-and-fantasy (#11),read,,,,1,,,0,,,,,
769658,Battlefield Earth: A Saga of the Year 3000,L. Ron Hubbard,"Hubbard, L. Ron",,"=""""","=""""",4,3.48,Galaxy Press,Paperback,1050,2001,1982,,2018/02/27,science-fiction-and-fantasy,science-fiction-and-fantasy (#10),read,,,,1,,,0,,,,,
8650,The Lost World (Jurassic Park #2),Michael Crichton,"Crichton, Michael",,"=""0752224417""","=""9780752224411""",4,3.79,"Alfred A. Knopf, Inc.",Mass Market Paperback,448,1995,1995,,2018/02/27,science-fiction-and-fantasy,science-fiction-and-fantasy (#9),read,,,,1,,,0,,,,,
7672,Congo,Michael Crichton,"Crichton, Michael",,"=""0060541830""","=""9780060541835""",4,3.61,Avon Books,Paperback,442,2003,1980,,2018/02/27,science-fiction-and-fantasy,science-fiction-and-fantasy (#8),read,,,,1,,,0,,,,,
7670,"The Andromeda Strain (Andromeda, #1)",Michael Crichton,"Crichton, Michael",,"=""0060541814""","=""9780060541811""",4,3.90,Avon Books,Paperback,327,2003,1969,,2018/02/27,science-fiction-and-fantasy,science-fiction-and-fantasy (#7),read,,,,1,,,0,,,,,
569429,"Mostly Harmless (Hitchhiker's Guide to the Galaxy, #5)",Douglas Adams,"Adams, Douglas",,"=""0345379330""","=""9780345379337""",4,3.96,Del Rey,Paperback,288,1993,1992,,2018/02/27,science-fiction-and-fantasy,science-fiction-and-fantasy (#5),read,,,,1,,,0,,,,,
6091075,"So Long, and Thanks for All the Fish (The Hitchhiker's Guide to the Galaxy, #4)",Douglas Adams,"Adams, Douglas",,"=""""","=""""",4,4.10,Del Rey,Kindle Edition,225,2008,1984,,2018/02/27,science-fiction-and-fantasy,science-fiction-and-fantasy (#6),read,,,,2,,,0,,,,,
8695,"The Restaurant at the End of the Universe (Hitchhiker's Guide to the Galaxy, #2)",Douglas Adams,"Adams, Douglas",,"=""""","=""""",4,4.21,Del Rey,Paperback,250,2005,1980,,2018/02/27,science-fiction-and-fantasy,science-fiction-and-fantasy (#3),read,,,,1,,,0,,,,,
386162,"The Hitchhiker's Guide to the Galaxy (Hitchhiker's Guide to the Galaxy, #1)",Douglas Adams,"Adams, Douglas",,"=""""","=""""",5,4.22,Del Rey,Paperback,193,2007,1979,,2018/02/27,science-fiction-and-fantasy,science-fiction-and-fantasy (#2),read,,,,1,,,0,,,,,
8694,"Life, the Universe and Everything (Hitchhiker's Guide to the Galaxy, #3)",Douglas Adams,"Adams, Douglas",,"=""0345418905""","=""9780345418906""",4,4.20,Del Rey,Paperback,224,2005,1982,,2018/02/27,science-fiction-and-fantasy,science-fiction-and-fantasy (#4),read,,,,2,,,0,,,,,
30831912,Norse Mythology,Neil Gaiman,"Gaiman, Neil",,"=""""","=""""",5,4.08,W. W. Norton & Company,Kindle Edition,304,2017,2017,,2018/02/27,mythology-प-र-ण-न,mythology-प-र-ण-न (#1),read,,,,1,,,0,,,,,
251823,The Parsifal Mosaic,Robert Ludlum,"Ludlum, Robert",,"=""075285853X""","=""9780752858531""",4,3.84,Orion,Paperback,760,2005,1982,,2018/02/27,spy,spy (#3),read,,,,1,,,0,,,,,
109510,The Negotiator,Frederick Forsyth,"Forsyth, Frederick",,"=""0553283936""","=""9780553283938""",3,3.99,Bantam,Mass Market Paperback,512,1990,1989,,2018/02/27,spy,spy (#2),read,,,,1,,,0,,,,,
11372652,Double Deal,Frederick Forsyth,"Forsyth, Frederick",,"=""""","=""""",3,3.86,,Mass Market Paperback,,,,,2018/02/27,spy,spy (#1),read,,,,1,,,0,,,,,
3504051,Iliad,Homer,"Homer, Homer",Samuel Butler,"=""0812004221""","=""9780812004229""",3,3.87,Barrons Educational Series Inc,Paperback,224,1971,-750,,2018/02/27,,,read,"Hector dear to deva-s, Diamedes, Ajax, Barbaric and brutish yet tender Achilles star in glorious and oft desperate combat in which the devatAs themselves take sides! That this happens is telling. Jupiter clearly reigns as the first among equals, rather than as puppet-master. Full of vIra-rasa. This tells us the early state of our Arya vaidika ancestors.",,,1,,,0,,,,,
5439,Interpreter of Maladies,Jhumpa Lahiri,"Lahiri, Jhumpa",,"=""0618101365""","=""9780618101368""",3,4.16,Houghton Mifflin Harcourt,Hardcover,198,2000,1999,,2018/02/27,,,read,See my review of the Namesake. Similar comments apply.,,,1,,,0,,,,,
33917,The Namesake,Jhumpa Lahiri,"Lahiri, Jhumpa",,"=""0618485228""","=""9780618485222""",4,3.99,Mariner Books,Paperback,291,2004,2003,,2018/02/27,,,read,"Gogol's parents raise him in Boston, he grows to be an architect; falls in love with maxine's relaxed but close knit family-  whose taste in life and nature appeal to thim more, with whom he feels more comfortable and therefore guilty. Then his father dies in Ohio and as he draws closer to his mother and sister, patient Maxine falls out. Then marries a bengali French lecturer, who starts an affair on her trips. Splits and alone at 33.<br/><br/>Captures the listlessness of kAma-pradhAna kids of artha-pradhAna Bengali American immigrants well, and the mix of love and contempt between the two generations.",,,1,,,0,,,,,
15823480,Anna Karenina,Leo Tolstoy,"Tolstoy, Leo","Aylmer Maude, Lev Tolstoi, Louise Maude, George Gibian","=""""","=""""",2,4.06,Vintage,Paperback,964,2012,1877,,2018/02/27,,,read," contrast (the social reject who cannot fully turn her back on the vile rotten society) anna k & vronsky adulterous pair with kitty/ levin (managing his country estate, exploring righteousness) pair to see who finds satisfaction ultimately!",,,1,,,0,,,,,
2967752,The Elegance of the Hedgehog,Muriel Barbery,"Barbery, Muriel",Alison Anderson,"=""1933372605""","=""9781933372600""",5,3.77,Europa Editions,Paperback,325,2008,2006,,2018/02/27,,,read," a hotel-manager with deliberately hidden sharp intellect due to a heart-breaking childhood, a prodigy feeling ennui about the futility of life and the fakeness of her family's refinement, a kind and cultured Japanese gentle man who seeks out the wise.<br/><br/> good  especially as it progresses.",,,1,,,0,,,,,
968,"The Da Vinci Code (Robert Langdon, #2)",Dan Brown,"Brown, Dan",,"=""""","=""""",1,3.86,Anchor,Paperback,489,2006,2003,,2018/02/27,,,read,"poor plot, jerky writing, much trivia",,,1,,,0,,,,,
325128,"Kidnapped (David Balfour, #1)",Robert Louis Stevenson,"Stevenson, Robert Louis",,"=""0439295785""","=""9780439295789""",4,3.79,Scholastic Paperbacks,Paperback,288,2002,1886,,2018/02/27,,,read,,,,1,,,0,,,,,
62111,The Swiss Family Robinson,Johann David Wyss,"Wyss, Johann David","Scott McKowen, Arthur Pober","=""1402726023""","=""9781402726026""",4,3.91,Sterling,Hardcover,345,2006,1812,,2018/02/27,,,read,,,,1,,,0,,,,,
2932,Robinson Crusoe (Robinson Crusoe #1),Daniel Defoe,"Defoe, Daniel",Virginia Woolf,"=""""","=""""",5,3.68,Modern Library,Paperback,320,2001,1719,,2018/02/27,,,read,,,,1,,,0,,,,,
13496,"A Game of Thrones (A Song of Ice and Fire, #1)",George R.R. Martin,"Martin, George R.R.",,"=""0553588486""","=""9780553588484""",5,4.45,Bantam,Mass Market Paperback,835,2005,1996,,2018/02/27,,,read,"House Stark, House Lannister and House Targaryen heiress (dragon lords) battle it out. Much intrigue, geopolitics. Great character development. Turned into an appealing video series. Major cultures/ band:s night-watch in the north, the wildlings, the evil others, the eununch 'unsullied' warrior slaves, Dothraki nomads.<br/> diverse and excellent character development, detailed imaginative world.",,,1,,,0,,,,,
13497,"A Feast for Crows (A Song of Ice and Fire, #4)",George R.R. Martin,"Martin, George R.R.",,"=""055358202X""","=""9780553582024""",4,4.14,Bantam Books,Mass Market Paperback,1061,2011,2005,,2018/02/27,,,read,,,,1,,,0,,,,,
6881206,The Night Bookmobile,Audrey Niffenegger,"Niffenegger, Audrey",,"=""0224089528""","=""9780224089524""",5,3.50,Jonathan Cape,Hardcover,40,2010,2008,,2018/02/27,,,read," graphic novel talking about a woman who after her encounter with the ghostly bookmobile filled with all books she has ever read becomes so engrossed in her love of books as to sacrifice many other things like family, general life etc.. to pursue her passion",,,1,,,0,,,,,
2978,Lost Horizon,James Hilton,"Hilton, James",,"=""0060594527""","=""9780060594527""",5,3.93,Harper Perennial,Paperback,241,2004,1933,,2018/02/27,,,read,,,,1,,,0,,,,,
13824,"The Doors of His Face, the Lamps of His Mouth",Roger Zelazny,"Zelazny, Roger",,"=""""","=""""",0,4.08,,,512,2005,1965,,2018/02/27,to-read,to-read (#6),to-read,,,,0,,,0,,,,,
239924,Blood of Amber (The Chronicles of Amber #7),Roger Zelazny,"Zelazny, Roger",Uf,"=""""","=""""",3,4.04,Avon Books,Mass Market Paperback,215,1995,1986,,2018/02/27,,,read,,,,1,,,0,,,,,
11127,"The Chronicles of Narnia (Chronicles of Narnia, #1-7)",C.S. Lewis,"Lewis, C.S.",Pauline Baynes,"=""""","=""""",3,4.26,HarperCollins,Paperback,767,2002,1956,,2018/02/27,,,read,,,,1,,,0,,,,,
76679,Forward the Foundation (Foundation: Prequel #2),Isaac Asimov,"Asimov, Isaac",,"=""0553565079""","=""9780553565072""",3,4.16,Bantam/Spectra,Paperback,464,1994,1993,,2018/02/27,,,read,,,,1,,,0,,,,,
30013,Prelude to Foundation,Isaac Asimov,"Asimov, Isaac",,"=""""","=""""",3,4.13,Voyager,Paperback,464,1994,1988,,2018/02/27,,,read,,,,1,,,0,,,,,
29580,Second Foundation (Foundation #3),Isaac Asimov,"Asimov, Isaac",,"=""0553803735""","=""9780553803730""",3,4.25,Bantam Spectra,Hardcover,256,2004,1953,,2018/02/27,,,read,,,,1,,,0,,,,,
29582,Foundation and Earth (Foundation #5),Isaac Asimov,"Asimov, Isaac",,"=""0553587579""","=""9780553587579""",3,4.06,Spectra,Paperback,500,2004,1986,,2018/02/27,,,read,,,,1,,,0,,,,,
3685,Black Beauty,Anna Sewell,"Sewell, Anna",,"=""0439228905""","=""9780439228909""",3,3.96,Scholastic Paperbacks,Mass Market Paperback,245,2003,1877,,2018/02/27,,,read,,,,1,,,0,,,,,
23814,"King Solomon's Mines (Allan Quatermain, #1)",H. Rider Haggard,"Haggard, H. Rider",,"=""0812966295""","=""9780812966299""",4,3.80,Modern Library,Paperback,264,2002,1885,,2018/02/27,,,read,,,,1,,,0,,,,,
20564,The Mill on the Floss,George Eliot,"Eliot, George",A.S. Byatt,"=""0141439629""","=""9780141439624""",4,3.80,Penguin Classics,Paperback,579,2003,1860,,2018/02/27,,,read,,,,1,,,0,,,,,
48485,"Blindsight (Jack Stapleton & Laurie Montgomery, #1)",Robin Cook,"Cook, Robin",,"=""0425136191""","=""9780425136195""",3,3.77,G.P. Putnam's Sons,Paperback,352,1993,1992,,2018/02/27,,,read,,,,1,,,0,,,,,
643809,"Tarzan and the Lost Empire (Tarzan, #12)",Edgar Rice Burroughs,"Burroughs, Edgar Rice",,"=""0345329570""","=""9780345329578""",3,3.76,Ballantine Books,Paperback,159,1979,1928,,2018/02/27,,,read,,,,1,,,0,,,,,
330110,"The Beasts of Tarzan (Tarzan, #3)",Edgar Rice Burroughs,"Burroughs, Edgar Rice",,"=""0809599848""","=""9780809599844""",3,3.76,Wildside Press,Paperback,240,2003,1914,,2018/02/27,,,read,,,,1,,,0,,,,,
589897,"The Return of Tarzan (Tarzan, #2)",Edgar Rice Burroughs,"Burroughs, Edgar Rice",,"=""1426450168""","=""9781426450167""",3,3.82,BiblioLife,Paperback,248,2007,1913,,2018/02/27,,,read,,,,1,,,0,,,,,
403355,"Pellucidar (Pellucidar, #2)",Edgar Rice Burroughs,"Burroughs, Edgar Rice","J. Allen St. John, Jack McDevitt, Phillip R. Burger","=""0803262043""","=""9780803262041""",3,3.77,Bison Books,Paperback,167,2002,1915,,2018/02/27,,,read,,,,1,,,0,,,,,
533415,Quentin Durward,Walter Scott,"Scott, Walter",,"=""1426426569""","=""9781426426568""",4,3.79,BiblioLife,Paperback,492,2008,1823,,2018/02/27,,,read,,,,1,,,0,,,,,
37447,The Inscrutable Americans,Anurag Mathur,"Mathur, Anurag",,"=""1577310241""","=""9781577310242""",2,3.27,New World Library,Paperback,224,1991,1991,,2018/02/27,,,read,,,,1,,,0,,,,,
1923820,Holy Bible: King James Version,Anonymous,"Anonymous, Anonymous",,"=""""","=""""",2,4.41,,Hardcover,1590,2008,1611,,2018/02/27,,,read,,,,1,,,0,,,,,
24128,The Merchant of Venice,William Shakespeare,"Shakespeare, William","Robert          Jackson, Barbara A. Mowat, Paul Werstine","=""0743477561""","=""9780743477567""",5,3.80,"Washington Square Press, Inc.",Paperback,337,1992,1596,,2018/02/27,,,read,,,,1,,,0,,,,,
478146,The Prize,Irving Wallace,"Wallace, Irving",,"=""0451094557""","=""9780451094551""",3,3.91,Signet,Paperback,704,1962,1962,,2018/02/27,,,read,,,,1,,,0,,,,,
78977,The Eleventh Commandment,Jeffrey Archer,"Archer, Jeffrey",,"=""0061013315""","=""9780061013317""",3,3.94,HarperTorch,Paperback,448,1999,1998,,2018/02/27,,,read,,,,1,,,0,,,,,
5297,The Picture of Dorian Gray,Oscar Wilde,"Wilde, Oscar",Jeffrey Eugenides,"=""""","=""""",4,4.09,Random House: Modern Library,Paperback,272,2004,1890,,2018/02/27,,,read,,,,1,,,0,,,,,
875775,Mission,Patrick Tilley,"Tilley, Patrick",,"=""0316845426""","=""9780316845427""",1,4.10,Little Brown and Company,Paperback,0,1981,1981,,2018/02/27,,,read,,,,1,,,0,,,,,
296298,The Guns of Navarone,Alistair MacLean,"MacLean, Alistair",,"=""0449214729""","=""9780449214725""",3,4.14,Fawcett,Mass Market Paperback,410,1984,1957,,2018/02/27,,,read,,,,1,,,0,,,,,
148337,Where Eagles Dare,Alistair MacLean,"MacLean, Alistair",Clint Willis,"=""1560254556""","=""9781560254553""",3,4.14,Thunder's Mouth Press,Paperback,320,2002,1967,,2018/02/27,,,read,,,,1,,,0,,,,,
529804,Brain,Robin Cook,"Cook, Robin",,"=""0451157974""","=""9780451157973""",3,3.77,G.P. Putnam's Sons,Paperback,307,1982,1981,,2018/02/27,,,read,,,,1,,,0,,,,,
48811,Nancy Drew: #1-64,Carolyn Keene,"Keene, Carolyn",,"=""0448445867""","=""9780448445861""",4,4.22,Grosset & Dunlap,Hardcover,,2006,2006,,2018/02/27,,,read,,,,1,,,0,,,,,
7190,"The Three Musketeers (The D'Artagnan Romances, #1)",Alexandre Dumas,"Dumas, Alexandre",,"=""""","=""""",5,4.07,Modern Library,Paperback,625,2001,1844,,2018/02/27,,,read,,,,1,,,0,,,,,
7126,The Count of Monte Cristo,Alexandre Dumas,"Dumas, Alexandre",Robin Buss,"=""0140449264""","=""9780140449266""",5,4.26,Penguin Classics,Paperback,1312,2003,1844,,2018/02/27,,,read,,,,1,,,0,,,,,
162898,A Connecticut Yankee in King Arthur's Court,Mark Twain,"Twain, Mark",,"=""""","=""""",5,3.77,Simon  Schuster,Paperback,480,2007,1889,,2018/02/27,,,read,,,,1,,,0,,,,,
62446,The Prince and the Pauper,Mark Twain,"Twain, Mark",Everett H. Emerson,"=""0451528352""","=""9780451528353""",4,3.86,Signet,Paperback,240,2002,1881,,2018/02/27,,,read,,,,1,,,0,,,,,
24583,The Adventures of Tom Sawyer,Mark Twain,"Twain, Mark","Guy Cardwell, John Seelye","=""0143039563""","=""9780143039563""",4,3.91,Penguin Classics,Paperback,244,2006,1876,,2018/02/27,,,read,,,,1,,,0,,,,,
2956,The Adventures of Huckleberry Finn,Mark Twain,"Twain, Mark","Guy Cardwell, John Seelye, Walter Trier","=""0142437174""","=""9780142437179""",4,3.82,Penguin Classics,Paperback,327,2002,1884,,2018/02/27,,,read,,,,1,,,0,,,,,
6440,Ivanhoe,Walter Scott,"Scott, Walter","Graham Tulloch, Walter Brendel, Richard Zoozmann","=""0140436588""","=""9780140436587""",4,3.75,Penguin Books /Penguin Classics,Paperback,496,2000,1819,,2018/02/27,,,read,,,,1,,,0,,,,,
22034,The Godfather,Mario Puzo,"Puzo, Mario","Robert Thompson, Peter Bart","=""""","=""""",4,4.36,NAL,Paperback,448,2002,1969,,2018/02/27,,,read,,,,1,,,0,,,,,
318525,Red Storm Rising,Tom Clancy,"Clancy, Tom",,"=""0394298667""","=""9780394298665""",3,4.17,Random House Audio,Audio Cassette,,1988,1986,,2018/02/27,,,read,,,,1,,,0,,,,,
40379,"The Warlord of Mars (Barsoom, #3)",Edgar Rice Burroughs,"Burroughs, Edgar Rice",John Bolen,"=""1400130220""","=""9781400130221""",3,3.87,Tantor Media,Audio CD,6,2001,1919,,2018/02/27,,,read,,,,1,,,0,,,,,
40271,"Alvin Journeyman (Tales of Alvin Maker, #4)",Orson Scott Card,"Card, Orson Scott",,"=""0312850530""","=""9780312850531""",3,3.74,Tor Books,Hardcover,381,2005,1995,,2018/02/27,,,read,,,,1,,,0,,,,,
3,"Harry Potter and the Sorcerer's Stone (Harry Potter, #1)",J.K. Rowling,"Rowling, J.K.",Mary GrandPré,"=""""","=""""",5,4.48,Scholastic Inc,Hardcover,309,2003,1997,,2018/02/27,,,read,,,,1,,,0,,,,,
33,The Lord of the Rings,J.R.R. Tolkien,"Tolkien, J.R.R.",,"=""""","=""""",4,4.50,Houghton Mifflin Harcourt,Paperback,1216,2005,1955,,2018/02/27,,,read,,,,1,,,0,,,,,
5907,"The Hobbit, or There and Back Again",J.R.R. Tolkien,"Tolkien, J.R.R.",,"=""0618260307""","=""9780618260300""",5,4.28,Houghton Mifflin,Paperback,366,2002,1937,,2018/02/27,,,read,,,,1,,,0,,,,,
